key	en	de	nl	fr	ru	es	pt	it	zh-Hans	ja	ko	zh-Hant	ar	th	vi	tr	pl	ms	id
q03_opt_C	Server Time around 21:00 - 22:00	Serverzeit ca. 21:00–22:00	Servertijd rond 21:00–22:00	Heure du serveur vers 21:00–22:00	Серверное время около 21:00–22:00	Hora del servidor alrededor de 21:00–22:00	Horário do servidor por volta de 21:00–22:00	Ora server intorno alle 21:00–22:00	服务器时间 大约 21:00–22:00	サーバー時間 おおよそ 21:00～22:00	서버 시간 대략 21:00–22:00	伺服器時間 約 21:00–22:00	وقت الخادم تقريبًا 21:00–22:00	เวลาเซิร์ฟเวอร์ประมาณ 21:00–22:00	Giờ máy chủ khoảng 21:00–22:00	Sunucu saati yaklaşık 21:00–22:00	Czas serwera około 21:00–22:00	Masa pelayan sekitar 21:00–22:00	Waktu server sekitar 21:00–22:00
q03_opt_D	Anytime	Jederzeit	Altijd	À tout moment	В любое время	En cualquier momento	A qualquer momento	In qualsiasi momento	任何时间	いつでも	언제나 괜찮음	任何時間	في أي وقت	ได้ทุกเวลา	Bất kỳ lúc nào	Her zaman	Udowolnej porze	Bila-bila masa	Kapan saja
q03_opt_E	N/A	nicht zutreffend	n.v.t.	sans objet	нет данных	No aplica	N/A	Non applicabile	不适用	該当なし	해당 없음	不適用	غير متوفر	ไม่มี	Không áp dụng	Geçerli değil	Nie dotyczy	Tidak berkenaan	Tidak berlaku

q04_title	Please choose your first choice of day.	Bitte wähle deinen bevorzugten Wochentag.	Kies je eerste voorkeursdag.	Veuillez choisir votre jour préféré.	Пожалуйста, выберите желаемый день недели.	Elige tu día preferido.	Escolha o seu dia preferido.	Scegli il tuo giorno preferito.	请选择第1希望的星期。	第1希望の曜日を1つ選んでください。	첫 번째로 선호하는 요일을 선택하세요.	請選擇您第一優先的星期。	يرجى اختيار اليوم المفضل الأول لديك.	โปรดเลือกวันในสัปดาห์ที่คุณต้องการเป็นอันดับแรก	Vui lòng chọn ngày ưu tiên 1.	Lütfen ilk tercih ettiğiniz günü seçin.	Wybierz swój preferowany dzień.	Sila pilih hari pilihan pertama anda.	Silakan pilih hari pilihan pertama Anda.
q04_opt_A	Monday	Montag	Maandag	Lundi	Понедельник	Lunes	Segunda-feira	Lunedì	星期一	月曜日	월요일	星期一	الاثنين	วันจันทร์	Thứ hai	Pazartesi	Poniedziałek	Isnin	Senin
q04_opt_B	Tuesday	Dienstag	Dinsdag	Mardi	Вторник	Martes	Terça-feira	Martedì	星期二	火曜日	화요일	星期二	الثلاثاء	วันอังคาร	Thứ ba	Salı	Wtorek	Selasa	Selasa
q04_opt_C	Wednesday	Mittwoch	Woensdag	Mercredi	Среда	Miércoles	Quarta-feira	Mercoledì	星期三	水曜日	수요일	星期三	الأربعاء	วันพุธ	Thứ tư	Çarşamba	Środa	Rabu	Rabu
q04_opt_D	Thursday	Donnerstag	Donderdag	Jeudi	Четверг	Jueves	Quinta-feira	Giovedì	星期四	木曜日	목요일	星期四	الخميس	วันพฤหัสบดี	Thứ năm	Perşembe	Czwartek	Khamis	Kamis
q04_opt_E	Friday	Freitag	Vrijdag	Vendredi	Пятница	Viernes	Sexta-feira	Venerdì	星期五	金曜日	금요일	星期五	الجمعة	วันศุกร์	Thứ sáu	Cuma	Piątek	Jumaat	Jumat
q04_opt_F	Saturday	Samstag	Zaterdag	Samedi	Суббота	Sábado	Sábado	Sabato	星期六	土曜日	토요일	星期六	السبت	วันเสาร์	Thứ bảy	Cumartesi	Sobota	Sabtu	Sabtu
q04_opt_G	Sunday	Sonntag	Zondag	Dimanche	Воскресенье	Domingo	Domingo	Domenica	星期日	日曜日	일요일	星期日	الأحد	วันอาทิตย์	Chủ nhật	Pazar	Niedziela	Ahad	Minggu
q04_opt_H	Any day	Jeder Tag	Elke dag	N’importe quel jour	Любой день	Cualquier día	Qualquer dia	Qualsiasi giorno	任何一天	どの曜日でも	어느 요일이든	任何一天	أي يوم	ได้ทุกวัน	Vào bất kỳ ngày nào	Herhangi bir gün	Dowolny dzień	Apa-apa hari	Hari apa saja








